id_laureat;nom;prenom;email;telephone;niveau_formation;filiere;annee_promotion;competences_techniques;soft_skills;certifications;experiences;cv_text;localisation;mobilite;disponibilite;linkedin;github_portfolio;statut_profil
L085;Alaoui;Hajar;hajar.alaoui85@example.com;0610061404;Technicien;Electricite Industrielle;2024;Electricite industrielle|Automatisme|Schema electrique|Maintenance electrique|Energie solaire;Sens du service|Adaptabilite|Organisation;Certification bureautique|Attestation stage;Stage de 2 mois en Electricite & Energie;"Profil Electricite Industrielle. Competences principales: Electricite industrielle ; Automatisme ; Schema electrique ; Maintenance electrique ; Energie solaire. Experience en Electricite & Energie. Recherche opportunite junior avec mobilite Marrakech ou Agadir.";Fes;Marrakech|Agadir|Nador;Immediatement;https://linkedin.com/in/laureat-85;;Valide
L086;Amrani;Imane;imane.amrani86@example.com;0610062135;Technicien;Genie Thermique;2025;Automatisme|Schema electrique|Maintenance electrique|Energie solaire|Climatisation;Adaptabilite|Organisation|Esprit analytique;Certification hygiene et securite;Projet pratique CMC en Electricite & Energie;"Profil Genie Thermique. Competences principales: Automatisme ; Schema electrique ; Maintenance electrique ; Energie solaire ; Climatisation. Experience en Electricite & Energie. Recherche opportunite junior avec mobilite Agadir ou Nador.";Marrakech;Agadir|Nador|Kenitra;Dans 1 mois;https://linkedin.com/in/laureat-86;;A completer
L087;Ziani;Ayoub;ayoub.ziani87@example.com;0610062866;Technicien;Service de Restauration Arts de table;2026;Housekeeping|Communication|Service client|Reception|Gestion reservations;Organisation|Esprit analytique|Rigueur;Certification metier CMC;Stage de 4 mois en Tourisme & Hotellerie;"Profil Service de Restauration Arts de table. Competences principales: Housekeeping ; Communication ; Service client ; Reception ; Gestion reservations. Experience en Tourisme & Hotellerie. Recherche opportunite junior avec mobilite Nador ou Kenitra.";Agadir;Nador|Kenitra|Meknes;Stage uniquement;https://linkedin.com/in/laureat-87;;Valide
L088;Haddadi;Hamza;hamza.haddadi88@example.com;0610063597;Qualification;Agent brancardier;2024;Urgences|Premiers secours|Soins de base|Hygiene hospitaliere|Prise des constantes;Esprit analytique|Rigueur|Gestion du stress;Certification bureautique|Attestation stage;Projet pratique CMC en Sante;"Profil Agent brancardier. Competences principales: Urgences ; Premiers secours ; Soins de base ; Hygiene hospitaliere ; Prise des constantes. Experience en Sante. Recherche opportunite junior avec mobilite Kenitra ou Meknes.";Nador;Kenitra|Meknes|Casablanca;CDI ou Stage;https://linkedin.com/in/laureat-88;;Valide
L089;Mansouri;Nour;nour.mansouri89@example.com;0610064328;Qualification;Aide-soignant;2025;Premiers secours|Soins de base|Hygiene hospitaliere|Prise des constantes|Dossier patient;Rigueur|Gestion du stress|Communication;Certification hygiene et securite;Stage de 2 mois en Sante;"Profil Aide-soignant. Competences principales: Premiers secours ; Soins de base ; Hygiene hospitaliere ; Prise des constantes ; Dossier patient. Experience en Sante. Recherche opportunite junior avec mobilite Meknes ou Casablanca.";Kenitra;Meknes|Casablanca|Rabat;Immediatement;https://linkedin.com/in/laureat-89;;Valide
L090;Naciri;Salma;salma.naciri90@example.com;0610065059;Qualification;Operateur Agricole;2026;Fertilisation|Suivi cultures|Agriculture de precision|Capteurs agricoles|SIG;Gestion du stress|Communication|Travail en equipe;Certification metier CMC;Projet pratique CMC en Agriculture;"Profil Operateur Agricole. Competences principales: Fertilisation ; Suivi cultures ; Agriculture de precision ; Capteurs agricoles ; SIG. Experience en Agriculture. Recherche opportunite junior avec mobilite Casablanca ou Rabat.";Meknes;Casablanca|Rabat|Tanger;Dans 1 mois;https://linkedin.com/in/laureat-90;;Valide
